{
  "A": [
    [0.0, 0.0],
    [0.585786437626905, 0.0]
  ],
  "C": [
    [0.0, 0.0],
    [-1.17157287525381, 0.0]
  ],
  "b": [0.8786796564403574, 0.2928932188134525],
  "btilde": [0.2928932188134525, 0.2928932188134525],
  "c": [0.0, 1.0],
  "controller": {
    "beta1": 0.35,
    "beta2": 0.2,
    "failfactor": 2,
    "gamma": 0.9,
    "pid_accept_safety": 0.81,
    "pid_beta3": 0,
    "qmax": 10,
    "qmax_first_step": 10000,
    "qmin": 0.2,
    "qoldinit": 0.0001,
    "qsteady_max": 1.2,
    "qsteady_min": 1,
    "source": {
      "file": "src/alg_utils.jl",
      "line": 776,
      "note": "beta1_default, beta2_default, gamma_default, qmin_default, qmax_default, qsteady_*_default, qmax_first_step_default and failfactor_default for this algorithm; qoldinit and the PID constants from src/integrators/controllers.jl (PIController, PIDController).",
      "package": "OrdinaryDiffEqCore",
      "version": "4.19.0"
    }
  },
  "d": [1.7071067811865475, -1.7071067811865475],
  "embedded_order": 1,
  "error_estimate": "embedded",
  "family": "rosenbrock",
  "first_same_as_last": false,
  "form": "rosenbrock_transformed",
  "gamma": 1.7071067811865475,
  "name": "ROS2",
  "order": 2,
  "ordinarydiffeq_algorithm": "ROS2",
  "schema": "https://earthsciml.org/schemas/esm-integrator/0.1.0/tableau.schema.json",
  "source": {
    "file": "src/rosenbrock_tableaus.jl",
    "line": 621,
    "package": "OrdinaryDiffEqRosenbrockTableaus",
    "version": "2.4.2"
  },
  "stages": 2,
  "stiffly_accurate": false
}
