{
  "alpha": [
    [1.0],
    [0.0, 1.0],
    [0.0, 0.0, 1.0],
    [0.0, 0.0, 0.0, 1.0],
    [0.6, 0.0, 0.0, 0.0, 0.4],
    [0.0, 0.0, 0.0, 0.0, 0.0, 1.0],
    [0.0, 0.0, 0.0, 0.0, 0.0, 0.0, 1.0],
    [0.0, 0.0, 0.0, 0.0, 0.0, 0.0, 0.0, 1.0],
    [0.0, 0.0, 0.0, 0.0, 0.0, 0.0, 0.0, 0.0, 1.0],
    [0.04, 0.0, 0.0, 0.0, 0.36, 0.0, 0.0, 0.0, 0.0, 0.6]
  ],
  "beta": [
    [0.16666666666666666],
    [0.0, 0.16666666666666666],
    [0.0, 0.0, 0.16666666666666666],
    [0.0, 0.0, 0.0, 0.16666666666666666],
    [0.0, 0.0, 0.0, 0.0, 0.06666666666666667],
    [0.0, 0.0, 0.0, 0.0, 0.0, 0.16666666666666666],
    [0.0, 0.0, 0.0, 0.0, 0.0, 0.0, 0.16666666666666666],
    [0.0, 0.0, 0.0, 0.0, 0.0, 0.0, 0.0, 0.16666666666666666],
    [0.0, 0.0, 0.0, 0.0, 0.0, 0.0, 0.0, 0.0, 0.16666666666666666],
    [0.0, 0.0, 0.0, 0.0, 0.06, 0.0, 0.0, 0.0, 0.0, 0.1]
  ],
  "c": [0.0, 0.16666666666666666, 0.3333333333333333, 0.5, 0.6666666666666666, 0.3333333333333333, 0.5, 0.6666666666666666, 0.8333333333333334, 1.0],
  "controller": null,
  "embedded_order": null,
  "error_estimate": "none",
  "family": "explicit_rk",
  "first_same_as_last": false,
  "form": "shu_osher",
  "name": "SSPRK104",
  "notes": [],
  "order": 4,
  "ordinarydiffeq_algorithm": "SSPRK104",
  "schema": "https://earthsciml.org/schemas/esm-integrator/0.1.0/tableau.schema.json",
  "source": {
    "file": "src/ssprk_perform_step.jl",
    "line": 1426,
    "note": "Transcribed from the perform_step! body, which writes the stages inline; alpha and beta are the same arithmetic regrouped (spec/methods.md §3.1).",
    "package": "OrdinaryDiffEqSSPRK",
    "version": "2.3.2"
  },
  "stages": 10,
  "stiffly_accurate": false
}
