{
  "A": [
    [0.0, 0.0, 0.0, 0.0, 0.0, 0.0, 0.0],
    [0.161, 0.0, 0.0, 0.0, 0.0, 0.0, 0.0],
    [-0.008480655492356989, 0.335480655492357, 0.0, 0.0, 0.0, 0.0, 0.0],
    [2.8971530571054935, -6.359448489975075, 4.3622954328695815, 0.0, 0.0, 0.0, 0.0],
    [5.325864828439257, -11.748883564062828, 7.4955393428898365, -0.09249506636175525, 0.0, 0.0, 0.0],
    [5.86145544294642, -12.92096931784711, 8.159367898576159, -0.071584973281401, -0.028269050394068383, 0.0, 0.0],
    [0.09646076681806523, 0.01, 0.4798896504144996, 1.379008574103742, -3.290069515436081, 2.324710524099774, 0.0]
  ],
  "b": [0.09646076681806523, 0.01, 0.4798896504144996, 1.379008574103742, -3.290069515436081, 2.324710524099774, 0.0],
  "btilde": [-0.001780011052225777, -0.0008164344596567469, 0.007880878010261995, -0.1447110071732629, 0.5823571654525552, -0.45808210592918697, 0.015151515151515152],
  "c": [0.0, 0.161, 0.327, 0.9, 0.9800255409045097, 1.0, 1.0],
  "controller": {
    "beta1": 0.14,
    "beta2": 0.08,
    "failfactor": 2,
    "gamma": 0.9,
    "pid_accept_safety": 0.81,
    "pid_beta3": 0,
    "qmax": 10,
    "qmax_first_step": 10000,
    "qmin": 0.2,
    "qoldinit": 0.0001,
    "qsteady_max": 1,
    "qsteady_min": 1,
    "source": {
      "file": "src/alg_utils.jl",
      "line": 776,
      "note": "beta1_default, beta2_default, gamma_default, qmin_default, qmax_default, qsteady_*_default, qmax_first_step_default and failfactor_default for this algorithm; qoldinit and the PID constants from src/integrators/controllers.jl (PIController, PIDController).",
      "package": "OrdinaryDiffEqCore",
      "version": "4.19.0"
    }
  },
  "embedded_order": 4,
  "error_estimate": "embedded",
  "family": "explicit_rk",
  "first_same_as_last": true,
  "form": "butcher",
  "name": "Tsit5",
  "notes": [
    "Stage 7 is f(u_new): b equals row 7 of A (first same as last), and btilde reads stage 7."
  ],
  "order": 5,
  "ordinarydiffeq_algorithm": "Tsit5",
  "schema": "https://earthsciml.org/schemas/esm-integrator/0.1.0/tableau.schema.json",
  "source": {
    "file": "src/tsit_tableaus.jl",
    "line": 45,
    "package": "OrdinaryDiffEqTsit5",
    "version": "2.1.5"
  },
  "stages": 7,
  "stiffly_accurate": true
}
