{
  "A": [
    [0.0, 0.0, 0.0, 0.0],
    [0.5, 0.0, 0.0, 0.0],
    [0.0, 0.75, 0.0, 0.0],
    [0.2222222222222222, 0.3333333333333333, 0.4444444444444444, 0.0]
  ],
  "b": [0.2222222222222222, 0.3333333333333333, 0.4444444444444444, 0.0],
  "btilde": [0.06944444444444445, -0.08333333333333333, -0.1111111111111111, 0.125],
  "c": [0.0, 0.5, 0.75, 1.0],
  "controller": {
    "beta1": 0.23333333333333334,
    "beta2": 0.13333333333333333,
    "failfactor": 2,
    "gamma": 0.9,
    "pid_accept_safety": 0.81,
    "pid_beta3": 0,
    "qmax": 10,
    "qmax_first_step": 10000,
    "qmin": 0.2,
    "qoldinit": 0.0001,
    "qsteady_max": 1,
    "qsteady_min": 1,
    "source": {
      "file": "src/alg_utils.jl",
      "line": 776,
      "note": "beta1_default, beta2_default, gamma_default, qmin_default, qmax_default, qsteady_*_default, qmax_first_step_default and failfactor_default for this algorithm; qoldinit and the PID constants from src/integrators/controllers.jl (PIController, PIDController).",
      "package": "OrdinaryDiffEqCore",
      "version": "4.19.0"
    }
  },
  "embedded_order": 2,
  "error_estimate": "embedded",
  "family": "explicit_rk",
  "first_same_as_last": true,
  "form": "butcher",
  "name": "BS3",
  "notes": [
    "Stage 4 is f(u_new) (first same as last)."
  ],
  "order": 3,
  "ordinarydiffeq_algorithm": "BS3",
  "schema": "https://earthsciml.org/schemas/esm-integrator/0.1.0/tableau.schema.json",
  "source": {
    "file": "src/low_order_rk_tableaus.jl",
    "line": 27,
    "package": "OrdinaryDiffEqLowOrderRK",
    "version": "2.2.6"
  },
  "stages": 4,
  "stiffly_accurate": true
}
